{"integrity_hash":"sha256:735f29f4cc780af31bbfb6253e68ca2d2137728b61a68afae5135e27f7680de3","permissions_hash":"sha256:82ced43ca30dd2d6109c81f51bdcd65455c4c2a41a7cdbc7512329d49f5f12ce","schema_version":"1.0","signed_at":"2026-02-08T11:23:18.887Z","skill":{"name":"quote-generator","type":"skill.md","version":"1.0.0"}}